{
  "schema": "welabs-motion-manifest/1",
  "schemaVersion": "1.2.0",
  "round": "portfolio-20261002",
  "brandVersion": "1.3.0",
  "generatedAt": "2026-10-12T20:08:04Z",
  "source": {
    "round": "/home/douglas/code/control/portfolio/motion/portfolio-20261002",
    "roundHead": "6b7f28a",
    "exportDir": "publish/site-v5",
    "plan": "site-redesign/plan-v5/motion-plan.md"
  },
  "brand": {
    "welabs": "1.3.0",
    "sealRule": "1.5.0",
    "endorse": "off"
  },
  "player": {
    "package": "hyperframes",
    "version": "0.8.104",
    "src": "/motion/v5/player.js"
  },
  "defaults": {
    "holdAfter": 1,
    "minScreenSeconds": 1.8,
    "transitionBetweenSteps": {
      "type": "push-left",
      "duration": 0.4,
      "ease": "power2.inOut"
    }
  },
  "pieces": {
    "domus-intro-s2-r2": {
      "src": "/motion/v5/pieces/domus-intro-s2-r2/index.html",
      "sha256": "d7ccec6822b0a1f165f7e0ed298cf696fe1c27c114a70f980cbca380d9698522",
      "sourceSha256": "068e9e10a8cd7c672e4703408ce8092473c1d526bd1b1bb59a46ee803915b984",
      "duration": 5.4,
      "width": 1920,
      "height": 1080,
      "endorse": "on",
      "siteVariant": {
        "hide": [
          ".role"
        ]
      },
      "posters": [
        "/motion/v5/posters/domus-intro-s2-r2--2067-1280.webp",
        "/motion/v5/posters/domus-intro-s2-r2--2067-640.webp",
        "/motion/v5/posters/domus-intro-s2-r2--3867-1280.webp",
        "/motion/v5/posters/domus-intro-s2-r2--3867-640.webp"
      ]
    },
    "hub-draw-born-ludic-v2-logos-r5-s1": {
      "src": "/motion/v5/pieces/hub-draw-born-ludic-v2-logos-r5-s1/index.html",
      "sha256": "8a68afa9d5a24a30114914afb6a370629de4a1a2d3bed6c7ff2d079b6afff696",
      "sourceSha256": "47540574d7115c86bb0e021f2f3e775e584aebfac9822a3b6bec5c670fb45dcd",
      "duration": 36,
      "width": 1920,
      "height": 1080,
      "minDisplayWidth": 800,
      "endorse": "on",
      "siteVariant": {
        "hide": [
          "#kick",
          "#close"
        ]
      },
      "posters": [
        "/motion/v5/posters/hub-draw-born-ludic-v2-logos-r5-s1--1500-1280.webp",
        "/motion/v5/posters/hub-draw-born-ludic-v2-logos-r5-s1--1500-640.webp",
        "/motion/v5/posters/hub-draw-born-ludic-v2-logos-r5-s1--20067-1280.webp",
        "/motion/v5/posters/hub-draw-born-ludic-v2-logos-r5-s1--20067-640.webp",
        "/motion/v5/posters/hub-draw-born-ludic-v2-logos-r5-s1--23100-1280.webp",
        "/motion/v5/posters/hub-draw-born-ludic-v2-logos-r5-s1--23100-640.webp",
        "/motion/v5/posters/hub-draw-born-ludic-v2-logos-r5-s1--26667-1280.webp",
        "/motion/v5/posters/hub-draw-born-ludic-v2-logos-r5-s1--26667-640.webp",
        "/motion/v5/posters/hub-draw-born-ludic-v2-logos-r5-s1--14650-1280.webp",
        "/motion/v5/posters/hub-draw-born-ludic-v2-logos-r5-s1--14650-640.webp",
        "/motion/v5/posters/hub-draw-born-ludic-v2-logos-r5-s1--24700-1280.webp",
        "/motion/v5/posters/hub-draw-born-ludic-v2-logos-r5-s1--24700-640.webp"
      ]
    },
    "hub-whole-house-ludic-logos-r4-s1": {
      "src": "/motion/v5/pieces/hub-whole-house-ludic-logos-r4-s1/index.html",
      "sha256": "6afbeffea7542a4d700e8d1c77e3521ab9b5c502ee616d4c88aa191ce3be9a91",
      "sourceSha256": "7dcf7515c4abcb4048fae96320b7111c11c3f0cf3e9077347a1ae8ee0d0cc82c",
      "duration": 36,
      "width": 1920,
      "height": 1080,
      "minDisplayWidth": 800,
      "endorse": "on",
      "siteVariant": {
        "hide": [
          "#kick",
          "#close"
        ]
      },
      "posters": [
        "/motion/v5/posters/hub-whole-house-ludic-logos-r4-s1--14300-1280.webp",
        "/motion/v5/posters/hub-whole-house-ludic-logos-r4-s1--14300-640.webp",
        "/motion/v5/posters/hub-whole-house-ludic-logos-r4-s1--28667-1280.webp",
        "/motion/v5/posters/hub-whole-house-ludic-logos-r4-s1--28667-640.webp",
        "/motion/v5/posters/hub-whole-house-ludic-logos-r4-s1--20800-1280.webp",
        "/motion/v5/posters/hub-whole-house-ludic-logos-r4-s1--20800-640.webp",
        "/motion/v5/posters/hub-whole-house-ludic-logos-r4-s1--26267-1280.webp",
        "/motion/v5/posters/hub-whole-house-ludic-logos-r4-s1--26267-640.webp"
      ]
    },
    "relloo-intro-s2-r3": {
      "src": "/motion/v5/pieces/relloo-intro-s2-r3/index.html",
      "sha256": "e8280b5107b09f2facecda7ba535b80f1d84c27a463ae306d8cb5f59eab679b8",
      "sourceSha256": "d2e65927493e9ad3e3627a04e7dff767e8caf7f90fddec4e30ada7cea667a081",
      "duration": 5.4,
      "width": 1920,
      "height": 1080,
      "endorse": "on",
      "siteVariant": {
        "hide": [
          ".role"
        ]
      },
      "posters": [
        "/motion/v5/posters/relloo-intro-s2-r3--2067-1280.webp",
        "/motion/v5/posters/relloo-intro-s2-r3--2067-640.webp",
        "/motion/v5/posters/relloo-intro-s2-r3--3867-1280.webp",
        "/motion/v5/posters/relloo-intro-s2-r3--3867-640.webp"
      ]
    },
    "crm-omnichannel-inbox-ludic2-logos-r4-s1": {
      "src": "/motion/v5/pieces/crm-omnichannel-inbox-ludic2-logos-r4-s1/index.html",
      "sha256": "06696f655f524f4f49c725a3aed9e191cd3a3f944f1ce31c97170d956be6092e",
      "sourceSha256": "1ebae814445e33f082654cbe1a06b655f4818c76b11cbc1c9521380ec3df1e88",
      "duration": 45,
      "width": 1920,
      "height": 1080,
      "minDisplayWidth": 800,
      "endorse": "on",
      "siteVariant": {
        "hide": [
          "#op",
          ".pos",
          "#close"
        ]
      },
      "posters": [
        "/motion/v5/posters/crm-omnichannel-inbox-ludic2-logos-r4-s1--5100-1280.webp",
        "/motion/v5/posters/crm-omnichannel-inbox-ludic2-logos-r4-s1--5100-640.webp",
        "/motion/v5/posters/crm-omnichannel-inbox-ludic2-logos-r4-s1--40167-1280.webp",
        "/motion/v5/posters/crm-omnichannel-inbox-ludic2-logos-r4-s1--40167-640.webp",
        "/motion/v5/posters/crm-omnichannel-inbox-ludic2-logos-r4-s1--8000-1280.webp",
        "/motion/v5/posters/crm-omnichannel-inbox-ludic2-logos-r4-s1--8000-640.webp",
        "/motion/v5/posters/crm-omnichannel-inbox-ludic2-logos-r4-s1--11300-1280.webp",
        "/motion/v5/posters/crm-omnichannel-inbox-ludic2-logos-r4-s1--11300-640.webp"
      ]
    },
    "crm-campaigns-journey-ludic2-logos-r4-s1": {
      "src": "/motion/v5/pieces/crm-campaigns-journey-ludic2-logos-r4-s1/index.html",
      "sha256": "9556c401e3e914b719fbffad13b7e6c769ce48c99ecdb9c06f67a61a54075ce2",
      "sourceSha256": "90bba8083f7e9b9471ab4c3d702afd33f382ef37e7a4acde6c2ad4fee24ce51f",
      "duration": 46,
      "width": 1920,
      "height": 1080,
      "minDisplayWidth": 800,
      "endorse": "on",
      "siteVariant": {
        "hide": [
          "#op",
          ".pos",
          "#close",
          ".adv"
        ]
      },
      "posters": [
        "/motion/v5/posters/crm-campaigns-journey-ludic2-logos-r4-s1--5100-1280.webp",
        "/motion/v5/posters/crm-campaigns-journey-ludic2-logos-r4-s1--5100-640.webp",
        "/motion/v5/posters/crm-campaigns-journey-ludic2-logos-r4-s1--41667-1280.webp",
        "/motion/v5/posters/crm-campaigns-journey-ludic2-logos-r4-s1--41667-640.webp"
      ]
    },
    "crm-agent-studio-ludic2-logos-r4-s1": {
      "src": "/motion/v5/pieces/crm-agent-studio-ludic2-logos-r4-s1/index.html",
      "sha256": "37ceac7210c3d1168277075441679e8fbd2db4461a73ade219c138a048f1629b",
      "sourceSha256": "e34584647b2503f2915fd4ead1ddc214d3ce9e0f2ab533c8ebc0df2fe76bafd5",
      "duration": 46,
      "width": 1920,
      "height": 1080,
      "minDisplayWidth": 800,
      "endorse": "on",
      "siteVariant": {
        "hide": [
          "#op",
          ".pos",
          "#close"
        ]
      },
      "posters": [
        "/motion/v5/posters/crm-agent-studio-ludic2-logos-r4-s1--5100-1280.webp",
        "/motion/v5/posters/crm-agent-studio-ludic2-logos-r4-s1--5100-640.webp",
        "/motion/v5/posters/crm-agent-studio-ludic2-logos-r4-s1--41600-1280.webp",
        "/motion/v5/posters/crm-agent-studio-ludic2-logos-r4-s1--41600-640.webp"
      ]
    },
    "magneto-intro-s3-r3": {
      "src": "/motion/v5/pieces/magneto-intro-s3-r3/index.html",
      "sha256": "2715be5eea23d3b01bbbce48648bb8dc91aeed8cfa138e5b6a0a2a44878a3ca4",
      "sourceSha256": "a6cc1ae681d7b35a641be33b65d21d2e0c73ca8bf53f369f491b8b8852faf204",
      "duration": 5.4,
      "width": 1920,
      "height": 1080,
      "endorse": "on",
      "siteVariant": {
        "hide": [
          ".role"
        ]
      },
      "posters": [
        "/motion/v5/posters/magneto-intro-s3-r3--2067-1280.webp",
        "/motion/v5/posters/magneto-intro-s3-r3--2067-640.webp",
        "/motion/v5/posters/magneto-intro-s3-r3--3867-1280.webp",
        "/motion/v5/posters/magneto-intro-s3-r3--3867-640.webp"
      ]
    },
    "flow-copilot-logos-r4-s1": {
      "src": "/motion/v5/pieces/flow-copilot-logos-r4-s1/index.html",
      "sha256": "8616d8634fc26eb671381956e579d9e6d75dd2cb2baef34efdf9ae487212b485",
      "sourceSha256": "5b9588dce3119562e5946724c24aaecb296007f1fdcb86581a0924be88795baf",
      "duration": 32,
      "width": 1920,
      "height": 1080,
      "minDisplayWidth": 800,
      "endorse": "on",
      "siteVariant": {
        "hide": [
          "#kick",
          "#close"
        ]
      },
      "posters": [
        "/motion/v5/posters/flow-copilot-logos-r4-s1--1000-1280.webp",
        "/motion/v5/posters/flow-copilot-logos-r4-s1--1000-640.webp",
        "/motion/v5/posters/flow-copilot-logos-r4-s1--24667-1280.webp",
        "/motion/v5/posters/flow-copilot-logos-r4-s1--24667-640.webp"
      ]
    },
    "flow-canvas-build-logos-r4-s1": {
      "src": "/motion/v5/pieces/flow-canvas-build-logos-r4-s1/index.html",
      "sha256": "99f9d4a54cea43556c320275bce4639a24fcc08936da3e71957536d4319e0bf0",
      "sourceSha256": "ac64be940f4203ed50fdf0ad760ea264e73ec032398a4577c2384992ab0ba35e",
      "duration": 31,
      "width": 1920,
      "height": 1080,
      "minDisplayWidth": 800,
      "endorse": "on",